,Random Ingredients,Recipe Title,Ingredient Phrases,Recipe Instructions,Recipe Titile
0,"basil,lemon,black pepper",," 2 1/2 lbs skinless, boneless chicken breasts | 2 pounds ripe tomatoes, undrained | 1 pound dried basil | 1 pound fresh parsley | 3 tablespoons lemon juice | 1 can whole water "," place the chicken in a saucepan and place over medium heat ; cook and stir over medium heat, until the chicken is cooked through and well browned, about 10 minutes.  remove chicken from the pan and allow it to cool.  meanwhile, bring the tomatoes to a rolling boil in a saucepan ; add water and reduce the heat to low.  add the fresh basil and parsley and lower the heat to mediumlow ; simmer, covered, for 10 minutes.  remove the chicken and vegetables from the pan and let cool to room temperature.  discard the marinade, then rinse under cold running water.  preheat the oven to 400 degrees f 200 degrees c.  sprinkle a baking sheet with aluminum foil.  season the chicken breasts with salt and pepper.  place the vegetables in a large roasting pan.  season generously with salt and pepper.  pour enough water into the pan to fill the chicken breasts one and 12 inch depth.  sprinkle the tomatoes with a generous amount of the reserved water.  place the rizini into the chicken breasts, coating well.  arrange half the rizini mixture over the tomatoes.  top with the tomatoes, then top the vegetables with the reserved sauce and herbs.  bake in the preheated oven until the flavors of the tomatoes and the reserved water are thoroughly blended and the chicken is thoroughly cooked, about 45 minutes. 


",Rizini With Tomato and Roasted Tomato
1,"green capsicum,soya sauce,gouda cheese,vinegar",," 3 ounces gouda cheese, grated ( i use a good brandy for this ) | 1 large green capsicum, sliced ( i use 1-1/2 tablespoons of green ) | 2 tablespoons vinegar | 1 tablespoon soya sauce "," cut capsicum in half lengthwise and crosswise.  slice capsicum crosswise and then crosswise.  mix together the vinegar, soy sauce and soya sauce and put in the small bowl with capsicum.  serve over lettuce, cucumber, and cheese. 


",Gouda Grilled Capsicum Salad
2,"vodka,parsley",," 1 3/4 ounces vodka or 1 3/4 ounces vodka | 1/4 cup milk | 1 dash parsley, minced ( optional ) "," puree the vodka, milk, and parsley in a blender until smooth.  pour into a glass and garnish with the marshmallows, if desired.  cut and serve. 


",Marshmallow Panna Cotta
3,"ancho chilies,curry,paprika,tilapia fillet,water chestnut,corn niblets",," 6 tablespoons corn niblets | 2 tablespoons curry ( paste or more to taste ) | 1/4 cup water chestnut, finely chopped | 4 tablespoons almonds, minced | 7 -8 garlic cloves, chopped | 1 tablespoon fresh coriander seeds or 1 1/2 tablespoons fresh ginger | 4 tablespoons coriander, chopped | 4 teaspoons ground curry | 1 teaspoon coriander powder | 1/2 teaspoon ground turmeric | 1/4 teaspoon ground cinnamon | fresh ground black pepper, to taste | 3/4 teaspoon salt, to taste | 3/4 cup sugar | 5 fresh tilapia fillets | 2 teaspoons paprika, or more to taste | 2 tomatoes, halved "," drain the niblets in several layers and add to a bowl.  whisk the curry paste, water chestnut, almonds, garlic, and 1 - 12 t of the spices together in a separate bowl until smooth ; pour this mixture into a saucepan over medium heat.  cook, stirring constantly, until the curry is fragrant and the nuts melt ; remove from the heat.  mix the sugar, tilapia fillets, and 1 t of the the spice mixture into the reserved curry mixture.  stir well to combine.  return the mixture to the skillet and heat slowly over medium heat, scraping up any browned bits from the bottom.  cook until the fish is firm but not falling apart, about 10 minutes.  meanwhile, prepare the paprika in a food processor, add the tomatoes and season with salt.  transfer the tomato mixture to the saucepan ; add the salt mixture and heat to a simmer over medium heat.  add the fish and cook over medium heat, swirling or turning the fish from time to time, until well cooked, about 10 minutes.  remove the fish from the heat, leaving a sliver of meat inside.  stir in the paprika.  pour the reserved curry sauce over the fish, mix the paprika, tamari sauce, paprika, ginger mixture to combine, and bring to a boil in the simmering sauce.  remove immediately from heat.  serve immediately in bowls. 


",Kurdish Fish
4,"onion soup mix,flat leaf parsley",," 2 potatoes, peeled and diced | 1 cup chopped onion or 1 cup carrot | 8 eggs, beaten | 3 tablespoons flour | 1/4 teaspoon curry powder | 1/4 cup flat leaf parsley, chopped "," dice the potatoes and onion.  make them into small sautees on lowmedium heat until the vegetables just start to soften, about 7 minutes.  add the eggs, and stirfry until foamy, about 5 minutes for the egg and potatoes.  slowly add in flour to the eggs, stirring well then add in the curry powder, parsley and salt and pepper to taste.  continue to stir the mixture, adding more flour as necessary, until everything is well mixed.  spoon the mixture into the prepared shells, and top with the remaining chopped veggies.  cover and bake at 400 degrees for 40 minutes. 


",Empanadas
5,"cooking apple,cayenne pepper,green chilies,cake flour,pie shell,plain flour",," 1 cake flour | 1 tablespoon cooking apple ( not the sliced ) | 1 tablespoon cooking water ( or chicken stock instead ) | 1 teaspoon ground black pepper | 1 pinch ground red pepper | 1 cup plain flour | 1 large cooking apple, peeled and cored | 1 teaspoon cayenne pepper "," preheat oven to 350 degrees f 175 degrees c.  sift together the first five ingredients with a large knife and shape each into a pie shell, about 1 inch thick.  place in the preheated oven and bake for 30 minutes, or until the apples are just tender.  remove from oven and let cool for 5 minutes before slicing across the top.  serve with mashed potatoes to top. 


",Mexican Apple Pie
6,"celery salt,pineapple juice,sugar,zucchini,white mushroom",, 2 cups chopped red onions | 1/4 cup chopped celery salt | 1/4 cup chopped pineapple juice ( optional ) | 1/2 cup slivered almonds ( optional ) | 1 teaspoon sugar | 1/2 cup fresh lime juice ( optional ) | 1/3 cup chopped zucchini ( optional ) | 2 garlic cloves ( chopped ) | 1/4 cup fresh grated fresh chives ( optional ) ," in a large skillet with medium heat, combine onion, celery salt and pineapple juice.  cook over mediumhigh heat, stirring frequently, until onion is softened, about 5 minutes.  pour in pineapple juice, almonds if using, sugar and lime juice.  cover and simmer until flavors blend, at least 2 hours and up to a cup.  add zucchini, if using.  season with salt and pepper and serve. 


",Spinach and Pineapple Salsa
7,"coconut milk,whipping cream,salsa,ra el hanout spice mix,chili paste,shortening",," 1 tablespoon shortening, melted | 1/2 teaspoon ground turmeric | 1 teaspoon chili paste | 1/2 teaspoon ground coriander | 1/2 teaspoon ground cinnamon | 1/2 teaspoon ground turmeric | 1/2 cup sweetened condensed milk | 2 tablespoons whipping cream | 1 teaspoon chopped fresh lemon zest | 1/4 cup desiccated coconut leaves "," preheat broiler.  in a medium size bowl or food processor, combine shortening, turmeric, chilli paste, coriander,  cinnamon, and spices.  shape into 12inch balls.  brush about 23 tbsp of paste mixture over mixture, then roll each ball between your fingers into a 12 inch rope  then tie ends with string.  refrigerate 4 hours or overnight in refrigerator.  arrange pies on baking sheets, top  side  bbq for an hour or till golden brown.  for the topping  melt the butter over medium heat  then spread the mixture to within 12 inch of the edge.  place pies over hot butter  sprinkle with additional tablespoon of sugar.  cool slightly, then cover and place in an oiled 400 degree oven for 3 - 12 hr or until puffed and puffed and golden.  serve hot with corn tortillas or rice. 


",Indian Cream-Salsa-Stuffed Crescent Pies
8,"tofu,jalapeno pepper,okra,whipping cream",," 12 ounces fresh okra, sliced ( or cabbages ) | fresh or canned jalapeno peppers, chopped | 1 lb fresh sushi, broken into pieces ( or cabbages ) | 1 1/4 cups whipping cream | 2 teaspoons ground smoked paprika "," sprinkle a layer of oil all over the surface of an okra in a nonstick skillet with some seasoning salt.  cook until the okra begins to brown, about 3 minutes.  remove from the pan, drain, and carefully transfer the skillet to the oven.  in a medium bowl, mix together the cream, garlic, and jalapeno.  place a teaspoon of the cream mixture onto the center of the okra.  starting at the middle of the edge, roll the roll to within about 18 inch of the center point of the filling.  place a large, flat spoonful of sushi or cabbage filling onto the edge of the rolled roll.  tuck the roll in the center with your palm.  press the edges together so it can easily roll up the sushi or cabbages.  cook and stir until the center is golden brown around the edges, about 3 minutes.  place a plate on the plate to allow the okra to relax for a few minutes before putting onto the plate.  the cooked okra will sink to the bottom of the plate as it cooks, and be mushy. 


",Strooped Okra (Or Cabbage Rolls)
9,"red lentil,beef steak",," 6 lbs beef steaks, cut into 1-inch pieces | 1 1/2 cups red lentils, cooked but not mushy | 1 cup beef gravy | 2 tablespoons fresh ground pepper "," heat oven to 500f degrees.  heat grill pan with 1 tablespoon of oil on high.  place cooked lentils on hot oil and sear for about 2 minutes.  drain on paper towels, reserving drippings.  add steak to pan.  cook for 5 minutes or until browned on all sides and tender.  stir in gravy and continue cooking for 5 minutes.  pour off any excess drippings.  season with more hot pepper to taste. 


",Roasted Red Lentil - Beef and Lentils
10,"pineapple,ketjap manis,citric acid,baby spinach",," 1/4 cup sweet paprika | 1/4 cup sugar | 1/2 cup ground nutmeg | peel, cored, and finely chop | 1/2 cup dates, finely chopped | 1 egg, separated | 1/2 cup chopped pecans or 1/2 cup almond | 2 tablespoons dried fruit, drained and chopped | 1 egg yolk | 1 teaspoon citric acid | 1 can chopped canned pepsi beans or ( 14 ounce ) can kidney beans | 8 large salad greens "," in a medium bowl, combine paprika, sugar, nutmeg, and lemon pecans.  add egg, egg yolk, citric acid, pepsi beans, and salad greens.  mix well.  cover and refrigerate at least 2 hours, or overnight. 


","Spinach, Mint and Pecans Salad"
11,"taco seasoning,chili flake,egg yolk,black pepper,papaya,water",," 24 hot black beans ( with liquid reserved ) | 4 cups water or 4 cups chicken broth | 1 teaspoon chili flakes | 1 package taco seasoning mix | 1 pound ground pork or 1 pound ground beef | 4 large egg yolks, lightly beaten | 2 green onions, chopped "," place black beans in a saucepan and soak until cool.  place remaining ingredients and soup in a blender and blend until wellcombined.  pour into a blender bag and cover with plastic wrap.  refrigerate overnight and serve at once. 


",Chili-Chunky Black Bean Soup
12,"cashew,apple juice,mini marshmallow,green pea,mint leaf,apricot jam",," 2 cans peeled and chopped apples, reserve juice | 2 cups apple juice | 1 cup apricot jam | 1/4 cup sweet basil, minced | 1/4 cup cashews, chopped | 1/4 cup mini marshmallows "," line 2 tart pans with parchment paper.  combine sliced apples, apricot jam, and sweet basil in a blender.  blend for 4 minutes or just until mixed.  add apple juice, jam mixture, and cashews.  stir into prepared 9 inch tart pan and bake in a 425 oven for 25 minutes, or until golden brown. 


",Honey Mint Apple Tart
13,"cilantro leaf,habanero pepper,roquefort cheese,cod,gingerroot",," 1 cup shredded cooked cod ( may use any favorite ) | 1 jar roasted garlic cloves or ( 12 ounce ) jar roasted garlic sauce | 3 cups roasted red chunky carrots, drained | salt and pepper | 2 cups thinly sliced gingerroot | 1/2 cup grated peeled carrot | 2 lbs ragu roquefort cheese, cubed or 1 lb parmesan cheese | 2 cups fresh lemon juice ( fresh would be best ) "," heat oven to 35.  place red chunky carrots, ginger, carrot, garlic sauce and salt and pepper in a food processor and puree until smooth.  add the remaining ingredients to a mediumsize bowl and stir until smooth.  spoon the mixture into a 13x9 baking pan.  bake in the preheated oven for 15 minutes on the first side or until done to your liking.  transfer to a wire rack to cool. 


",Vietnamese Roquefort and Cheddar Bake
14,"soy sauce,nutmeg,turnip,sauerkraut,baby spinach,ricotta cheese,quinoa,curry powder",," 1 cup quinoa | 1 cup baby spinach | 1/2 tablespoon curry powder ( or to taste ) | 1/4 teaspoon nutmeg | 1/4 teaspoon curry powder ( or to taste ) | 2 cups cooked sauerkraut ( or as desired ) | 1/4 cup chopped fresh spinach, defrosted "," cook quinoa according to package directions, drain and set aside.  make soup according to package directions add a little bit of boiling water to the broth, and let thicken.  in a large saucepan, bring quinoa and spinach to a rapid boil.  lower heat, cover and let simmer for 45 minutes.  stir into quinoa mixture and cook 5 minutes longer, until creamy. 


","Quinoa & Aubergine Soup With Sweet and Sour Peas, Spinach & Ricotta"
15,"bamboo shoot,tilapia fillet,parsley,dark rum,dulce de leche",," 4 tilapia fillets, trimmed | 1/2 cup fresh parsley, chopped | 1/4 cup dulce de leche | 1/8 cup dark rum | 2 -4 cups bamboo shoots or 2 -4 cups halved bamboo shoots, stemmed "," preheat griddle over medium heat.  mix together parsley, dulce de leche, and rum and set aside.  sprinkle fish with remaining ingredients and toss to evenly coat.  garnish with fresh parsley and serve warm. 


",Lemon Punch
16,"peanut oil,amaretto,molasses,cooking oat,cream,ranch dressing mix,vodka",," 3 tablespoons peanut oil | 2 cups ranch dressing mix | 2 tablespoons vodka | 2 tablespoons molasses | 2 teaspoons amaretto | 2 teaspoons sprite | 2 teaspoons cream, whipped "," combine dressing mix and molasses ; stir over low heat.  stir in amaretto and cream ; whip until thick, add whipped cream and molasses mixture ; refrigerate.  serve warm or at room temperature with whipped cream. 


",Pampered Hoagies With Cream
17,"chicken,cooking spray,cumin seed,mayonnaise,golden raisin,chili powder,beef stew meat",," 3 lbs hot chili powder, fresh | 1 yellow onion, chopped | 1 lb ground beef stew meat | 1 tablespoon minced garlic | 1 teaspoon ground cumin seed | 1/4 teaspoon ground red chili powder | 1/4 cup mayonnaise | 1/4 cup golden raisin | 8 jalapeno peppers, diced | cooking spray | 1 can tomatoes, chopped "," in a dutch oven or casserole combine the chili powder, onions, and beef.  mix everything well.  cover, and cook about 15 minutes over low heat. 


","Jalapeno Chili (A.
    -k.
    -a.
    - Black Pepper Chili)"
18,"chili pepper flake,sirloin tip roast,chicken wing,red curry paste,pasta,celery",," 8 -10 fresh basil leaves and pieces of fresh oregano, coarsely chopped | 1 lb sirloin tip roast, sliced into matchstick-shaped pieces | 1 1/2 tablespoons red curry paste, or to taste | 6 teaspoons chili peppers ( see my recipe ) | 6 teaspoons crushed roasted red curry paste ( see my recipe ) | 6 stalks celery ( garnish ) | 24 ounces pasta ( with steamed vegetables ) "," in a large saucepan, cook the basil, 12 tablespoon dried oregano, and 1 teaspoon chili pepper in the hot sauce over medium heat, stirring occasionally, until the basil has dried out, about 8 minutes.  set the roast in a large heavy roasting pan with the red curry paste, and season with chili peppers.  in another pan, brown the steak in the remaining 12 tablespoon dried oregano, stirring until evenly browned, about 30 seconds.  add 12 tbsp of the cooking chicken broth to the meat and simmer for 5 minutes.  strain the meat to remove any remaining cooking liquid.  discard the chicken broth and serve the meat and sauce separately. 


",Pollo Di Lente Espanola
19,"prosciutto,parsnip,gelatin,pizza sauce,madras curry powder,parmigiano reggiano cheese,cauliflower floret,pie shell",," 1 pound cauliflower floret, trimmed | 12 large cooked pinto beans | 24 ounces canned pimento stuffed beans, undrained | 2 cans crushed tomatoes | 1/4 cup chopped fresh basil leaves | 3 teaspoons madras curry powder | 1/4 teaspoon salt and ground black pepper to taste | 4 cups prepared pizza sauce | 1 can pinto beans, drained & rinsed | 1 loaf fresh grated parmigiano-reggiano cheese | 1 tablespoon chopped fresh parsley "," heat oven to 400 degrees f.  grease a 9inch pie dish.  place the cauliflower fillet, beans, tomatoes, basil, curry powder, salt, and black pepper in a blender.  pour in the pizza sauce.  puree.  season with salt and pepper.  mix in the pimento and beans.  pour half of the sauce mixture over the cheese.  bake in the preheated oven until the cheese has melted and set, about 2 hours.  remove from heat ; let cool for 10 to 12 minutes.  stir cheese mixture and cheese mixture between 2 plates, and serve. 


",Italian Pecorino Alla De Cecciata
20,"butter,pork butt",, 500 g pork butt - cut into chunks ," preheat the oven to 200c 190c gas mark 2.  remove the fat from the fat and add the Pork to the cavity of your oven proof tin or the fat from your carbibb.  remove it from the heat and gently rub it in the fat.  put the pork into a baking tray with a rack in the centre and fill with 1 cup of water from the tin.  leave it for 1 hour and then pour it over the tray with a spoon.  you can even cook it in the oven for 1 hour on a foil baking tray.  you can bake it at 200c or 170c for 15 minutes on the rack with the sides down but you must do so according to your specific heat of your oven.  let the pork stand for 30 minutes in the tin.  remove any fat or bits and leave it in the tin and cook it in the oven.  you can cook it at 200c or 170c for 15 minutes on the rack with 3 cups of water from the tin and the sides down.  serve chilled or with biscuits. 


",Smoky Pork With Biscuits
21,"thai pepper,bacon dripping",," 10 ounces red onions, chopped | 1/2 cup sliced green chilies, toasted | 2 tablespoons minced garlic cloves | 1 1/2 teaspoons finely chopped fresh ginger | 2 tablespoons olive oil | 2 cups thinly sliced pitted peeled thai peppers | 1 teaspoon sugar | freshly ground black pepper "," stir the onions, chilies, garlic, ginger, olive oil, and chiles into a saucepan over medium heat.  stir and cook, stirring occasionally, until the chiles are soft but not scorched, about 5 minutes.  stir in sugar and pepper.  season with salt and pepper.  cover and cook over medium heat until the sauce has reduced into half, about 5 minutes.  stir frequently to prevent sticking.  cover and chill until serving.  serve over noodles or rice.  note if you plan on cooking on a day ahead, let the sauce cool at least 30 minutes before serving. 


",Thai Pepper Salad
22,"kernel corn,coffee,salt pepper,rosemary sprig,poblano chile,pea,white onion",," 20 pecans | 6 poblano chiles, deseeded and patted dry | 1 cup white onion, finely chopped | 1/2 cup peas ( not peas packed ) | 1 teaspoon rosemary sprig, chopped | 1 teaspoon salt & pepper, to taste | 2 teaspoons instant coffee, crushed "," clean pecans and chop finely.  chop onion and chile.  peel and chop pecans.  saut onion in 3 tbl.  of the hot, butter until translucent.  saute pecans in 3 tbl.  of the butter until tender about 10 minutes.  remove from the heat and add rosemary and salt and pepper.  add beans and beans and pecans to skillet and cook till heated through.  garnish with sprigs of fresh lime, if desired.  if you are serving with chili sauce, stir over mediumlow heat until the sauce thickens. 


",Crock Pot Mexican Peppers Con Poblano
23,"espresso powder,black eyed pea,chow mein noodle,deli roast beef,beef,broth,cinnamon,lasagna noodle",," 1 lb ground beef | 1/2 cup low-sodium fat-free instant veggie broth | 4 ounces dried white wine | 1 tablespoon espresso powder | 1 teaspoon dry sherry or 1 teaspoon brandy | 2 tablespoons vegetable oil | 2 teaspoons powdered cinnamon | 1 lb deli roast beef, sliced into 1/2 inch strips | 1/2 cup chopped fresh black-eyed peas | salt & freshly ground black pepper "," combine meat, broth, wine and espresso powder in a medium saucepan.  bring to a boil ; reduce heat, cover and simmer for 15 minutes to set in the refrigerator.  strain liquid into a large resealable plastic bag and add remaining ingredients.  refrigerate for 1 hour ; reserve juices.  heat oil in a skillet over mediumhigh heat ; cook beef strips until browned ; set aside.  in a medium saucepan, melt vegestrone crumbs over high heat.  add beef, browning on all sides.  sprinkle with cinnamon mixture.  reduce heat to medium ; simmer for 1 minute ; stir in peas and season to taste with salt and pepper.  cover ; simmer for 10 minutes. 


",Beef in Hot Wine Sauce
24,"molasses,mustard seed,pine nut,vanilla essence,prawn,cumin powder,italian sausage",," 1 1/2 cups flour | 2 teaspoons baking soda | 2 teaspoons molasses | 3/4 teaspoon cinnamon | 1/4 teaspoon nutmeg | 1 1/2 cups sugar | 1 jar of crushed pineapple nuts, cut into 1/2 inch chunks | 1 teaspoon baking soda | 1 teaspoon baking soda | 1/8 teaspoon fennel seed | 1 egg | 4 ounces italian sausage, sliced | 1/2 cup flaked prawns, slivered "," prepare an oblong crust or a 9 inch pie pan in this order.  combine the first nine ingredients in a bowl ; mix well.  shape into a 12inch round and refrigerate for up to 1 day.  spread the remaining ingredients evenly over the dough, overlapping to make 9 round patties, and refrigerate for up to 2 months.  preheat an oven to 350 degrees f.  bake pies 10 minutes or until lightly browned on the top.  allow pies to cool on an ungreased cookie sheet for 20 minutes.  remove and discard the pits and cut into wedges.  transfer to a cooling rack.  bake for 12 minutes or until a toothpick inserted into the center comes out clean.  allow the prawns to cool completely.  preheat a oven to 300 degrees f and preheat the oven s pan.  cut a 4 inch circle from the center of two circles of dough to make a small depression in the center, leaving a 1 inch border around it.  spoon dough over the center edge of the depression.  starting at the base of each triangle, roll up each circle and place seam side down on cookie sheet.  with fingers to seal, carefully pinch edges of dough together to form a triangle about as wide as the tip of a large fork.  place triangles seam side down on baking sheet.  bake for 25 minutes or until crisp. 


",Agnoli
25,"shiitake mushroom,leek",," 4 leeks, cut into thin slices | 1/2/3 lb smoked shichimi mushroom, peeled | 2 lbs frozen shiitake mushrooms, thawed "," cut leeks in half lengthwise, then cut each half crosswise lengthwise into 12 strips.  cut each strip lengthwise into 13 strips.  in a large pot, combine the mushrooms with water to cover, and cover with boiling water.  heat until mushrooms are tender.  cool 5 minutes.  discard mushrooms to drain again, cool 15 minutes.  remove from water, cool, and cut into quarters.  in a large nonstick frying pan, melt wok over high heat ; add mushroom and saute until golden brown, about 3 minutes.  add shichimi and mushrooms to pan, and stir to coat.  stir in shiitake mushrooms, and return pan to stove.  add water to cover ; stir until liquid comes up to a boil.  return skillet to stove top, and cook 3 minutes, stirring continuously, until hot.  remove from stove, stirring constantly, and transfer to serving bowl.  for additional flavor, pour about 2 tablespoons sour cream into mushroom mixture to combine.  serve with steamed pita or other meat and vegetables. 


",Liché (Low-carb Steamed Shichimi Mushrooms)
26,"shallot,hot pepper,black bean",," 1 can black beans | 1 cup canned diced shallot | 1 jar crushed dried hot peppers | 1 tablespoon salt and pepper, to taste | 2 cups shredded cheddar cheese, divided "," place beans, shallots, hot pepper and salt and pepper in medium saucepan.  cover and simmer gently stirring occasionally for 34 minutes or until mixture returns to a boil, stirring often.  reduce heat to low and cook for 20 minutes or until the beans are tender and the sauce begins to thicken.  add remaining ingredients and stir to combine.  sprinkle with remaining cheese. 


",Black Bean and Black Pepper Chili
27,"currant,chicken bouillon,green bean,pecorino cheese,haricot bean,tomato sauce,spice,hamburger",," 2 cups cooked hamburger ( cooked but not too raw ) | 1 can petite diced tomatoes and sauce | 1 cup chopped green beans ( or frozen mixed beans, rinsed, drained, and rinsed ) | 1 can tomato sauce | 1/3 cup coarsely crushed haricot bean or 1/3 cup other small bean ( rinsed and drained ) | 14 ounces mixed cooked hamburger, divided | 1/3 cup currants | 1/2 teaspoon ground coriander "," mix all ingredients except currants in a resealable bag, shake tightly to blend.  in a skillet over medium heat saut the currants for about 20 seconds, add the remaining ingredients and stir until well blended and all the ingredients are cooked thoroughly.  store in an airtight container. 


",Spiced Green Bean Burgers
28,"white rice,corn oil,raspberry jam,cranberry,baking potato,balsamic vinegar,ham",," 4 cups white rice ( i used rice brand ) | 2 baking potatoes, peeled and cut crosswise into 1/2-inch-wide strips | 1/2 cup cranberry preserves | 3 tablespoons corn oil | 2 tablespoons balsamic vinegar | 1/4 cup raspberry jam "," combine the rice, potatoes, preserves, oil, balsamic vinegar and jam in a small bowl.  season to taste with salt and pepper.  heat 4 tablespoons of the oil in a skillet on medium heat and cook rice until the liquid is almost gone ; drain and toss with the rice mixture in a large bowl. 


",Danish Rice Fries
