,Random Ingredients,Recipe Title,Ingredient Phrases,Recipe Instructions,Recipe Titile
117,"cooking oil,kernel corn,pepperoni,picante sauce,tuna",," 8 ounces frozen picante sauce | 10 ounces canned tuna, drained | 1/2 cup cooking oil | 1/8 cup red bell pepper, diced | 12 fresh firm ripe plant-ripe ripe tomatoes, sliced "," cook the frozen picante sauce in medium saucepan over high heat until sauce is thickened.  combine tuna, and all ingredients in a large bowl ; toss to coat.  refrigerate at least 2 hours.  heat oil in a large skillet over medium heat.  add mixture, and cook 30 seconds or until hot.  remove from heat, cover, and set aside.  fill 2 tortillas with tuna filling ; place on tortillas, top with tomatoes, and serve. 


",Pasta with a Picante Sauce and Filling
118,"spanish onion,raisin,white wine vinegar",, 6 slices spanish onions | 6 sprigs raisins | 8 ounces white wine vinegar ( or 1/2 cup dry white wine vinegar ) ," place the onion slices in a bowl.  dice the raisins as well.  mix the wine vinegar with the vinegar and add to the onion slices, toss to combine.  drizzle with half the onions and half the vinegar mixture.  serve with the remaining onion slices on the side. 


",Spanish Onion & Vinegar Salad
119,"vegetable oil,red bell pepper,portabella mushroom,marsala wine,haddock fillet,msg,pimiento",," 2 portabella mushrooms | 1/3 cup marsala wine | 1/4 cup vegetable oil | 1/2 teaspoon msg | 2 tablespoons chopped pimiento | 1 red bell pepper, chopped | 1 lb cavities de provence "," preheat the oven to 500 degrees f.  peel the portabella mushroom and cut the stems off and discard them, set aside.  soak portobello mushrooms in the vermouth of 3 cups water for about 30 minutes, then remove from the water and let cool to about room temperature.  in an ovenproof large deep skillet, heat 1 tablespoon oil over mediumhigh heat, or to a hot oil about 5 inches in diameter.  add mushroom heads and cook until tender, about 10 minutes.  add more oil if necessary, until the pan starts to brown.  add wine and remaining 3 cups water.  stir until the wine, liquid and spices are dissolved.  reduce the heat to medium.  cover and cook until liquid evaporates a little, adding more water if necessary, about 30 minutes.  add peppers and cook until peppers are cooked through and tender, stirring every 8 minutes, about 15 minutes.  transfer the peppers to a bowl.  strain and discard any drippings. 


",Papa Girottes (Steaks and Portobello Portabello)
120,"spring onion,coriander,fish sauce,chive,rosemary leaf,chard leaf",," 4 cups cooked chinese fish sauce, thai | 3 tablespoons lime juice | 1/2 shallot, minced | 1 tablespoon minced fresh ginger | 1 small shallot, minced | 2 teaspoons finely seeded coriander | 1/2 cup fresh white corn kernels | 1 teaspoon dried rosemary leaves, crushed | 1 cup fresh water "," pour lime juice, shallot, ginger, shallot, coriander, and water and bring to a boil in a saucepan with 2 teaspoons salt.  cook uncovered, stirring until the shallot is well wilted, about 10 minutes.  stir corn kernels and rosemary into the mixture and simmer uncovered until tender, 10 minutes. 


",Fish & Beans
121,"millet flour,process american cheese,mustard powder,chili oil,splenda sugar substitute,cardamom,pistachio",," 1 cup splenda sugar substitute | 2/3 cup whole milklet flour | 1 teaspoon ground cardamom | 1/4 cup whole wheat processed american cheese, grated | 2 cups crushed pistachios | 1/2 teaspoon mustard powder | 1 dash chili oil "," set up a saucepan with boiling water.  mix together sugar and milklet flour.  gradually add milk mixture to milk mixture while whisking for a few more minutes until mixed.  keep beating constantly until the mixture is smooth and creamy.  add the whole wheat cheese, crushed pistachios, and mustard powder, stir for a few seconds until the dough forms a ball.  turn dough on its floured and knead gently.  cover and refrigerate for 1 hour to let it rest in a cool place before using.  heat oil in a 12inch dutch oven or a 12quart saucepan until it starts to smoke.  put the dough onto a floured work surface and knead again until you have a smooth crust, about 5 minutes.  brush it with the oil and sprinkle with the remaining breadcrumbs.  press down gently with the floured work surface to smooth it out.  set aside.  preheat oven to 375 degrees.  cover and keep warm until the pudding is ready. 


",Creamy Cakes - New Year's Pudding
122,"salt,sherry,zucchini,liquid honey,chuck roast,vanilla",," 2 lbs chuck roast | 2 cups liquid honey | 2 tablespoons liquid honey ( honey must remain in the original recipe ) | 1 can sweet, diced, peeled zucchini, drained | 2 tablespoons granulated sugar | salt "," place roast in a 6 quart heavy saucepan over low heat.  cover and cook over high heat stirring often, until meat thermometer reads 160 degrees f, about 10 minutes.  remove cover and transfer meat to a medium size bowl.  stir in remaining ingredients ; season with salt.  serve in 6 qt slow cooker or dutch oven.  baste with reserved liquid honey or vegetable honey.  refrigerate over night or until ready to cook. 


","Sweet BBQ Beef and Veggie Stew With Zucchini, Honey and Seasonings"
123,"anchovy,sun tomato",, 2 medium dried anchovy | 2 large sun-dried tomatoes | fresh orange or white wine or sparkling wine ," place the dried anchovy and the sun dried tomatoes in an attractive container.  cover the container tightly with plastic wrap and refrigerate for at least an hour before serving. 


",Anchovy Tomatoes
124,"chunky salsa,five spice powder,banana,strawberry preserve",," 2 cans pumpkin puree | 1 can chunky salsa, undiluted | 1/3 cup heavy cream | 6 ounces banana | 1/4 ounce five-spice powder "," in a blender, combine the pumpkin puree, chunky salsa, and cream.  blend until smooth.  remove from blender ; stir in banana.  add the puree mixture to the pumpkin mixture ; mix well.  cover and chill until ready to serve. 


",Cuban Pumpkin Sundae
125,"apricot,extra sharp cheddar cheese",," 3 tablespoons cornstarch | 1/2 cup sugar | 2 tablespoons olive oil | 2 tablespoons extra-sharp cheddar cheese | 200 g apricot jam ( small and small, crushed to a fine powder ) "," in a large nonstick pan, heat the oil over medium heat.  add the flour and cook for 4 minutes or until smooth and thickened.  add the cornstarch and cook for about 3 minutes, stirring constantly, until thick and glossy.  remove from the heat and reserve, stirring constantly.  add the sugar, the remaining oil, and 2 tablespoons of the cheeses, toss well to coat.  add a pinch of salt to taste.  reduce the heat to a low simmer and cook for 15 minutes, stirring frequently, until it is hot and thickened.  season with pepper and serve right away or chill at room temperature. 


",Tabbouleh
126,"dill,prosciutto,pork loin,saffron thread,arborio rice,alfredo sauce,pine nut",," 1 1/2 lbs pork loin | 1/4 teaspoon saffron thread | 1/4 cup pine nuts | 1 pint fat free alfredo sauce | 4 cups arborio rice, cooked and cooled "," preheat oven to 425 degrees f 220 degrees c.  cut pork into cubes.  in large bowl blend saffron, pine nuts, 2 tablespoons of pork fat, a little of the alfredo sauce, and 1 cup cold water.  pour over pork pieces and stir to coat all sides and sides.  let stand 5 minutes.  drain pork.  cut diagonally into 3inch cubes.  pour a large pot of cold water over top of broth.  bring 3 to 4 inches deep.  place rice cubes in pan.  stir 3 to 4 tablespoons alfredo sauce, 1 to 2 tablespoons alfredo sauce, and 2 tablespoons cold water to bring to a boil.  when rice is cooked enough to coat all sides and sides, transfer to large nonstick skillet.  heat 2 tablespoons oil in pot.  add 1 pound of pork and cook until pork is firm and cooked through, about 8 minutes.  remove from skillet and turn to other side.  spoon 1 tablespoon alfredo sauce evenly over pork.  serve over the rice. 


",Pine Nuts & Roast Pork
127,"garlic salt,almond milk,pancetta,grain white rice",," 8 cups long grain white rice ( or 4 1/2 cups rice ) | 2 cups quick-cooking frozen pancetta, finely chopped | 1/2 - 1/2 cup chopped roasted almonds ( optional ) | 1/4 teaspoon garlic salt | 1/4 cup slivered almonds, toasted "," wash and dry rice by using a paper towel, and then cover the rice with fresh plastic wrap.  refrigerate until you have time.  remove the rice plastic wrap from the refrigerator while you prepare the filling and prepare the flaky rice by cutting out the core from the pancetta.  peel the pancetta finely then slice into 14 inch thick rounds.  using a meat grinder, grind the pistachios and almonds in a bowl over a high heat for 5 to 7 minutes each side, stirring occasionally.  stir in the rice and pancetta, then pour the filling on top of the pancetta and stir until well blended.  taste and adjust seasoning with salt and pepper.  serve hot with white or brown rice.  can be made 1 day ahead.  can be made 1 day ahead.  store in refrigerator if desired and refrigerated. 


",Easy Rice Pilaf
128,"korma paste,red bell pepper,confectioner ' sugar,rom tomato",," 1 head green onion, chopped | 1 package frozen chopped tomatoes, thawed | 2/3 cup red bell pepper, chopped | 1 small red bell pepper, chopped | 2 cloves garlic, minced | 1/2 teaspoon paprika | 1 tablespoon chilis powder | 5 cups garbanzo beans, rinsed and drained | 2 tablespoons fresh parsley, finely chopped | 3 cans chicken breasts, cut into chunks | 1 1/4 teaspoons dried oregano | 2 teaspoons dried basil, finely chopped | 1 teaspoons bottled confectioners'sugar | 1/4 teaspoon ground ginger "," saute onion, diced tomatoes, peppers, garlic, paprika, chilis, and garlic in oil in large nonstick skillet over medium high heat until golden brown, about 5 minutes.  add tomatoes and saute just until softened, about 1015 minutes.  combine garbanzo beans, parsley, chicken, seasonings, 1 cup water, and 1 - 12 teaspoons sugar in medium, heavy soup pan.  bring to boil.  reduce heat and simmer uncovered 3 minutes.  stir in broth and cook 2 minutes longer.  combine basil, sugar, and ginger ; cool slightly.  stir in chilaquiles. 


",Chilaquiles
129,"bay leaf,shiitake mushroom,poblano chile,veal,apple,whipping cream",," 2 lbs chuck steaks ( sirloin cut 2-inch thick and 3/4-inch long, 1-inch thick ) | 1 tablespoon fresh lime juice | 1 can poblano chile in adobo, drained and coarsely chopped | 2 ounces canned shiitake mushrooms, sliced | 2 bay leaves | 1 cup whipping cream | 2 cups whipping cream, stiff peaks, whipped or more to taste "," combine lime juice, sirloin, and chiles in a medium bowl.  arrange steak on a baking sheet.  combine mushroom slices and bay leaves in an ovenproof casserole dish or serving platter, and drizzle with 12 cup cold water.  cover and bake at 375 degrees for about 4550 minutes, or until well browned and tender.  transfer to an individual serving platter and cover with foil ; let soak for 5 minutes, then drain.  return to oven and add cream.  mix well.  pour sauce over beef and serve topped with whipped cream. 


",Mexican Roast Skewers
130,"green chili pepper,part mozzarella cheese,curry powder,french tarragon,eggplant,chicken breast,avocado,chili",," 3 eggs | 2 cans crushed tomatoes, drained, quartered | 1 can diced yellow tomatoes | 3 cans peeled green chili peppers | 4 teaspoons fresh ginger, chopped | 3 garlic, minced | 1 tablespoon minced fresh parsley | 14 1/2 ounces diced potatoes | 2 tablespoons minced onions | 1/2 teaspoon paprika | 1 tablespoon minced fresh cayenne | 1 tablespoon minced fresh curry powder | 1 1/2 teaspoons chili powder | 1 teaspoon ground cinnamon | 1/2 teaspoon ground black pepper | 1/4 teaspoon cayenne | 2 teaspoons minced fresh peeled garlic | 1 1/2 teaspoons minced fresh parsley | 1 avocado, sliced into wedges | 1 - 1 1/2 cup french tarragon salad dressing, mixed with | 3/4 cup sliced part-skim mozzarella cheese | 2 large eggs | 1 red bell peppers, deseeded and seeded "," cook the eggs in a large pot of salted water just until fully set.  remove the eggs and set aside.  in a large bowl, combine the eggs, tomatoes, bell peppers, ginger, sweet peppers, onion, paprika, curry powder, chili powder, cinnamon, and black pepper.  season with cayenne and salt to taste.  in a small bowl, combine the garlic, parsley, potatoes, onions, garlic, and half of the avocado ; toss to combine.  in the remaining bowl, combine 2 cups of the salad dressing, the 12 cup the cheese, and the beaten eggs.  mix and add the chicken into the eggs and toss to coat thoroughly.  cover the skillet with a lid and cook over medium to deep heat, adding water as needed to keep the mixture dry.  cook until the sauce is thick and bubbling, about 20 minutes.  remove the skillet from the heat and set aside.  stir the remaining avocado and half of the salad dressing into the eggs.  serve the chicken over the egg and vegetables.  if the dish is too dry, place the chicken, onion mixture, remaining salad dressing, and mozzarella cheese and mix well.  to make the chicken salad dressing, combine salad dressing, remaining 3 cups of salad dressing, and remaining 34 cup of salad dressing ; mix well.  in a large skillet over medium heat, combine the remaining 1 cup of salad dressing and half of the mozzarella cheese.  season with salt to taste.  when the chicken and veggies are cooked and golden, reduce heat to mediumlow and add the reserved chicken and onions. 


",Chicken in Tomato Sauce
131,"crust,arborio rice,ramen noodle,linguine,breadcrumb",, 1 lb linguine | 2 cups coarse breadcrumbs | 1 tablespoon grated dried anchovy | 3 1/2 ounces sliced smoked ramen noodles | 2 cups arborio rice ( cooked to al dente ) ," cook pasta according to package directions, drain.  meanwhile, dice bread crumbs into small dice or in large bowl with water.  heat 2 tablespoons oil in a pot until hot enough to toast.  place bread crumbs in crumbs and toast until goldenbrown.  spread bread crumbs out on baking sheet.  place rice in small pan and place on warm oil.  let brown until crisp on one side, about 10 minutes set aside.  to the bowl with rice, add anchovies and pork and stir until blended.  remove from heat, stir in noodles and riesotto.  serve immediately. 


",Linguine With Risotto Crust
132,"puff pastry,anchovy paste,swiss chard,grain white rice,cumin seed,sirloin tip roast,spice,cooking spray",," 5 1/2 lbs boneless beef top sirloin tip roast, cut into 1-inch cubes ( bone in ) | 3 ounces swiss chard stems, stems trimmed, washed and stemmed, wiped dry | 14 whole bay leaves | 3 stalks garlic cloves, crushed | 14 large fresh corkscrew stemmed mushrooms, chopped and drained | 3/4 teaspoon fresh ground black pepper | 1 tablespoon mild smoked anchovy paste | 2 teaspoons dried anchoicapro leaf, minced | cooking spray | 1/2 teaspoon ground cumin seeds "," in large soup pot, layer roast in 13x9x2inch glass baking dish.  sprinkle with garlic and corkscrew, cover with aluminum foil, and steam on low heat for 2 hours, stirring occasionally.  in bowl, combine chard stems, roasted garlic, anchovies and anchoicapro ; add 12 teaspoon black pepper to spice mixture.  coat roast generously in spice mixture ; let stand for 45 minutes.  in same saute pan, brown beef over high heat until browned and tender.  transfer browned beef to rack ; sprinkle with remaining half of spices.  place roast in covered roasting pan ; cover with aluminum foil.  cook on high for 1 - 12 hours or until meat registers 160 degrees f.  remove foil and let stand 20 minutes.  meanwhile, remove stems from mushrooms and stems, reserving stems.  sprinkle mushrooms with remaining spice mixture.  simmer over medium heat for 10 minutes or until liquid is reduced by half and mushrooms are tender.  stir remaining spice mixture.  return beef to the pan and cook for 5 more minutes or until beef is no longer pink, stirring occasionally.  remove beef from pan and transfer to cutting board.  arrange stems, mushrooms, and mushrooms on serving platter.  drizzle remaining 12 teaspoon pepper over mushroom mixture and serve garnished with sprig of cilantro. 


",South African Beef Roast
133,"hot sauce,tomato green chilies,bay leaf,dark brown sugar,bacon bit,madeira wine,ricotta cheese",, 6 slices thick sliced bacon bits | 1 jar sweetened condensed milk | 8 slices thick sliced tomatoes with green chilies | 6 slices thick slices bacon bits | 3 large bay leaves | 8 slices thick mozzarella cheese | 2 tablespoons madeira wine or 2 tablespoons balsamic vinegar ," in a large bowl, combine bacon bits, condensed milk, tomato, chiles and bacon bits.  add bay leaves, cheese and madeira, mix well and chill 10 minutes to marinate.  heat oven to 425f and place soup spoon in a 9 pie plate.  cover the pie plate and bake for 20 minutes.  uncover and cook for 45 minutes longer or until top is light brown and center is brown.  sprinkle some croutons on top and bake, uncovered, for a further 20 minutes. 


",Tarte Gourmet French Onion Soup
134,"haddock fillet,grain rice,egg wrapper,yellow cornmeal,peanut butter,orange juice",," 1 package refrigerated egg roll wrappers | 1/4 cup finely chopped yellow cornmeal | 1/4 cup quick-cooking peanut butter | 1 large egg, lightly beaten | 1/8 cup finely chopped orange juice | 6 large firm prawns, peeled and deveined | 1 tablespoon dry roasted peanuts, crumbled "," preheat oven to 400 degrees f 200 degrees c.  prepare an ovenproof dish with aluminum foil and spread the egg roll wrapper evenly on the bottom.  spread 23 of the cornmeal in the corner.  fold the sides up over the filling.  lay the shrimp on top of the cornmeal, then spread 23 of the peanut butter.  repeat, ending with 2 more pieces of shrimp and peanut butter.  place two prawns on top of the pan, and layer on 12 the cornmeal.  fill with roasted peanuts.  cover the mixture with foil and bake in the preheated oven until prawns are completely tender, 25 to 35 minutes. 


",Pistachio Prawns With Orange Rice
135,"head cabbage,mustard,allspice,purpose flour,phyllo pastry,pine nut,vidalia onion",," 5 1/2 cups all-purpose flour | 1/2 cup unsalted pine nuts | 2 tablespoons honey | 1 cup finely ground allspice | 1/4 cup lemon juice | 1/4 cup fresh lemon juice | 1 head romaine lettuce, chopped | 1 large vidalia onion, chopped | 1 large head cabbage, cut into 1-inch thick strips | salt and pepper to taste "," preheat oven to 350 degrees f 175 degrees c.  combine flour, pine nuts, honey, allspice, lemon juice, and lemon juice in a large bowl.  place in a 9x13 inch baking dish.  add cabbage, onion, lettuce, vidalia onion, and salt and pepper.  sprinkle the topping evenly over the cabbage. 


",Cabbagey Dried Cabbage Rolls
136,"white sesame seed,apricot",," 1 teaspoon white sesame seeds | 2 tablespoons oil | 1 egg, beaten | 1 bunch green onion, quartered | 1 tomatoes, seeded and coarsely chopped | 1/2 cup chopped apricot "," in a saucepan over medium heat, stir together the sesame seeds, oil, and egg.  when the egg begins to set, stir in the green onion.  mix thoroughly, set aside.  in a large skillet sprayed with pam, bring about 2 cups of water to a boil.  add the tamari and cook for 8 to 10 minutes.  remove from heat and discard the pulp.  pour into a bowl, and cover with plastic wrap and shake vigorously.  cover the bowl with plastic wrap, and refrigerate at least 2 hours.  to serve, ladle or pipe into warm bowls.  you may make a thin film with the tamari and serve with steamed rice. 


",Cherry With Tofu
137,"shallot,cauliflower floret,mushroom",, 4 cups cauliflower florets | 3/4 cup dry white wine | 12 tablespoons chopped shallots | 2 leaves fresh basil ," in a shallow bowl, mix cauliflower florets together.  in a medium saucepan, combine wine and shallots.  bring to boil, stirring often.  continue to boil, covered, for about 2 minutes, until reduced, stirring occasionally.  pour into large saucepan, and cook for 8 minutes or until tender.  place shallots on a salad plate, garnish with basil. 


",Cauliflower With Cauliflower Stir Fry
138,"wine vinegar,margarita mix,romaine lettuce,kidney bean,ice water",," 3 lbs boneless skinless kidney beans, scrubbed, trimmed and trimmed | 1/2 lb roma romaine lettuce, coarsely shredded | 1 pound tomatoes, coarsely diced | 1/4 cup sugar-free cider vinegar | 1/2 teaspoon salt and pepper | 2/3 cup chilled margarita mix | 1 can low sodium water, divided "," place beans in blender or food processor.  puree until smooth.  in large bowl combine roma, tomato, sugarfree, 1 tablespoon cider vinegar and seasonings.  blend until smooth.  add beans and mix well.  refrigerate until ready to serve.  adjust seasonings if desired. 


",Mexican Spicy Kidney Beans
139,"garlic paste,great northern bean,cilantro,asparagus,balsamic vinegar,vegetable broth,water chestnut,vermouth",," 1/2 lb asparagus, ends trimmed | 1/4 cup vermouth | 1 tablespoon garlic paste | 1/2 cup celery, chopped | 1/2 cup water chestnut, chopped | 2/3 cup balsamic vinegar | 1/3 cup vegetable broth | 1 1/2 cups great northern bean "," simmer the asparagus for 5 minutes, remove the pan from heat, drain and set aside.  place the vermouth, garlic paste, celery, water chestnut, celery, vinegar and broth into a blender and puree until smooth.  pour into a soup pitcher, bring to a boil and then lower to a simmer.  meanwhile, cook the bean, stirring regularly, in a 5 to 7 quart slow cooker over medium heat until cooked through but still firm to the bite.  stir in the beans and remaining ingredients.  serve garnished with the bean slices. 


",Fruity Asparagus Soup
140,"anise oil,walnut,caraway seed,parsnip",," 3 1/2 cups sugar | 1/2 cup water | 2 tablespoons apple juice | 2 cinnamon sticks | 6 cloves | 1 1/2 tablespoons baking soda | 1 1/2 teaspoons baking powder | 1/2 teaspoon ground anise seed | 1/2 teaspoon baking soda | 2 1/2 cups walnuts, chopped "," combine sugar and water in a large saucepan.  bring to a boil over mediumhigh heat.  reduce heat and simmer 5 minutes or until sugar dissolves and liquid is thickened.  cool to lukewarm.  in a large mixing bowl, combine apple juice, cinnamon, cloves, baking soda and baking powder.  stir into sugar mixture for 2 minutes.  add remaining ingredients and blend well.  allow mixture to cool completely.  store in airtight container. 


",Sandy Walnut Cookies
141,"ricotta cheese,oat,orecchiette,cilantro,red potato,mexicorn,vanilla essence,cucumber",," 4 small red potatoes | 3 tablespoons fresh orange juice | 3 3 tablespoons water | 1 teaspoon vanilla essence | 1 1/4 teaspoons fresh lime juice | 1 pinch salt and pepper | 1 pound canned whole tomatoes, rinsed and diced | 1/2 cup chopped cilantro | 1/4 cup chopped fresh orecchiette | 1/4 cup chopped fresh parsley | 1/2 cucumber, peeled and thinly sliced | 2 tablespoons ricotta cheese | 1/4 cup crumbled oregano "," saut potatoes in a skillet until tender ; do not overcook.  drain, reserving drippings.  stir orange juice and water in a large pot over mediumhigh heat.  bring to a boil, then cover, and reduce heat to mediumhigh ; cook and stir until liquid is evaporated, 5 to 10 minutes.  add vanilla essence, lime juice, salt, and pepper, and cook, stirring occasionally, until hot and bubbly, about 5 minutes.  pour into a blender along with tomatoes, cilantro, orecchiette, parsley, and cucumber, and puree until smooth.  season to taste with salt and pepper and sprinkle with oregano if desired.  preheat oven to 350 degrees f 175 degrees c.  bake in preheated oven for about 30 minutes, until hot and bubbly. 


",The Amazing and Yummy Spaghetti With Lighter Tomato Sauce
142,"lime juice,spicy tomato sauce,chicken breast,queso fresco",," 4 skinless, boneless chicken breasts | 2 tablespoons spicy tomato sauce | 2 teaspoons lime juice | 1 medium cup shredded queso fresco "," heat a grill for mediumhigh heat.  place chicken breasts on grill and cook, turning once, until browned on all sides, about 5 minutes per side.  turn breasts once.  transfer chicken breasts to a rack in a shallow roasting pan.  pour tomato sauce over all chicken.  season to taste with lime juice.  cover and refrigerate at least 1 hour.  heat 1 - 12 tablespoons of the remaining marinade in a skillet over medium heat.  cook and stir quesadilla in the hot mixture until thoroughly coated, about 10 minutes.  sprinkle with shredded cheese and serve. 


",Chicken and Tomato Quesadillas
143,"ziti pasta,picante sauce,french baguette,kalamata olive,chicken stock,baby carrot,green pepper,swiss chard",," 2 chicken breasts | 1 cup picante sauce | 3 tablespoons picante sauce | 1 tablespoon chopped italian parsley | 1/4 teaspoon crushed red pepper flakes | 1/4 teaspoon crushed garlic | 4 tablespoons minced swiss chard, divided | 6 ounces v8 vegetable bouillon cubes | 1 cup chicken broth | 1 package ziti pasta, cut into bite-size pieces "," in food processor or blender, puree chicken and picante sauce until smooth.  season with parsley and red pepper flakes.  add vegetables bouillon cubes, undrained ziti, broth and 1 cup chicken broth.  process till smooth.  cover and refrigerate at least 30 minutes. 


",Chicken and Veggies With French Faux
144,"confectioner ' sugar,cucumber,red onion,green chili,thyme,burgundy wine,tart apple",," 10 ounces spaghetti | 1/2 cup red onion, chopped | 4 cloves garlic, minced | 14 ounces burgundy wine | 2 cups sugar | 1 cup tart apples | 3 tablespoons lemon juice | 1 tablespoon thyme | 1/4 teaspoon clove | 1/4 teaspoon sugar | 1/4 cup confectioners'sugar | 1/4 cucumber, peeled and sliced "," bring large pot of salted water to a boil.  cook spaghetti in boiling water for 1 minute ; drain.  meanwhile, chop and saute onion, garlic, and burgundy ; set aside.  chop and saute apples in small pan on low heat, stirring occasionally.  add wine, 1 tablespoon of sweet salsa, cinnamon, sugar, and confectioners sugar.  reduce heat and simmer, stirring often, until sauce thickens, about 5 minutes or more.  sprinkle with cucumber slivers before serving. 


",Spaghetti With Sweet Salsa
