,Random Ingredients,Recipe Title,Ingredient Phrases,Recipe Instructions,Recipe Titile
245,"mayonnaise,potato starch,white wine,vanilla pod,ginger paste",," 1 tablespoon ginger paste | 1/2 cup diced cooked chicken breast | 3 tablespoons white wine | 1/8 teaspoon vanilla pod | 1/4 cup unsweetened coconut milk, smooth | 1/4 cup banana | 1 tablespoon potato starch or 1 tablespoon low sodium soy paste | 1 lemon, zest of ( optional ) "," mix ginger and the chicken and place in the top of a buttered 9 spring form pan.  allow the ginger to marinate for 12 hour.  heat the white wine in the oven and cook the skin side up till it starts to boil.  this happens after 2 minutes.  remove from the oven and stir in the coconut milk.  reduce the heat to medium and add the banana and mashed potato starch.  cook for 1015 minutes.  this tastes best when the skin is white.  add the lemon zest and lemon peel if using if using.  reduce the heat to low and add the ginger paste before cooking until it thickens.  you may also add the lemon zest if using.  pour the mixture over the chicken and bake for 2530 minutes until the skin is golden brown and cooked through.  garnish with powdered sugar if desired. 


",Banana Chicken Bites
246,"vegetable,rigatoni pasta,lamb,great northern bean,taco seasoning mix",," 2 lbs lamb, cut into cubes | 1 lb ground beef | 1/2 cup water | 2 garlic cloves, crushed | 2 cups chopped great northern beans ( or you can substitute the dried beans ) | 1 packet taco seasoning mix ( or your favorite packet ) | 1 package rigatoni pasta "," preparation.  brown meat in large skillet over medium heat.  drain and set aside.  bring water to boil in large skillet over medium heat.  add garlic, beans and taco seasoning mix.  mix well until beans are soft and the liquid has reduced significantly.  when liquid has cooked down to a smooth consistency, add a bit more water if necessary to make dough a smooth mass.  punch dough down again and form into a log ; it should be about 8 inches long and 5 inches in diameter.  if you like better meat, you can add a little more flour to form a soft dough.  form meat into round patties about 12 inch in diameter ; remove to a large plate.  cover and keep warm if you are using a rotisserie.  to make stuffing.  remove 12 cup hot water from the bottom of the pan with a spatula ; add the beef ; drain excess water.  mix together the meat, water and bean water.  cover and let simmer for 25 minutes.  preheat broiler.  remove meat from heat ; remove plastic wrap and wrap as much as you wish.  broil about 9 inch above middle of flame on high heat until meat reaches halfway up the sides of pan.  remove with slotted spoon to cutting board ; cut meat into bitesize portions.  transfer to a cutting board and cut again, cutting sides down.  cut each pattie into 4 pieces.  sprinkle beef with salt and pepper.  cook until beef is cooked through, about 3 minutes.  transfer beef to cutting board and sprinkle on flour to coat.  chill 1 hour.  spoon reserved cooking water from skillet and return it to saucepan.  heat to boiling, then reduce heat to mediumlow.  when mixture boils, add pasta and toss with reserved sauce.  serve as is. 


",Easy Ground Beef Tacos
247,"raisin,beet",," 1/4 lb beet, peeled and cut into chunks | 1/2 cup raisins, plus extra for garnish ( or 2-3 tablespoons ) | 2 teaspoons dry mustard "," blanch carrots at 350 degrees for 45 minutes, or until very soft and easily flaked with a fork.  stir in the raisins and mustard.  chill for at least 30 minutes, at least overnight.  serve in salad bowls.  enjoy                                                                                    

 ## Cooking instructions ##
 for the dressing  combine all the dressing ingredients  refrigerate until used. 


",Sweet and Creamy Beetroot Salad
248,"saltine cracker,puff pastry,wasabi powder,pepperoni,vegetable shortening,mango",," 2/3 cup unsweetened coconut milk | 8 tablespoons vegetable shortening | 1 tablespoon sugar | 1 teaspoon ground coriander | 1/2 teaspoon salt ( or to taste ) | 1 lb firm puff pastry, cut into 1-inch pieces | 2 tablespoons chopped garlic | 1/8 cup sliced fresh mango | 2 cups shredded cooked rice, or as needed ( optional ) | 1 -2 tablespoon fresh coarsely chopped fresh coriander "," heat 2 tablespoons of the vegetable shortening in a saucepan over mediumhigh heat.  add sugar and toss until mixture begins to caramelize, about 20 seconds.  add half of the coconut milk, followed by one cup of the shortening and whisk until the shortening melts.  mix the remaining 2 tablespoons of shortening, 2 teaspoons vegetable shortening, and half of the mango into the saucepan and mix until smooth.  remove from heat.  spread half of the tofu mixture on the 1 inch of the pastry dough in the bottom of a 9inchsquare or doublelayered baking dish.  fold up the flan so that it hangs from the edge.  press firmly into the bottom of the prepared pan.  repeat with remaining pastry and tofu.  using a pastry brush, paint evenly over the tofu mixture.  refrigerate until set, about 1 hour.  preheat oven to 450 degrees f 230 degrees c.  brush a castiron skillet with 2 tablespoons of vegetable shortening.  cook and stir the tortilade over low heat until the oil begins to brown, 20 to 25 minutes.  using a slotted spoon, transfer the cooked tortilade to a plate.  drain the oil from the pan.  remove the pan from the heat.  spoon the hot oil on top of the tortilade.  bake for a thin, brown, about 2 minutes.  drain any remaining oil from the pan.  serve with the remaining mango sauce.  to make the coconutflan  whisk together the reserved cooking coconut milk, half the rice, 6 tablespoons of coriander, and 1 - 12 teaspoons salt in a medium bowl.  whisk in the mango sauce, 3 tablespoons of the lime juice, remaining 12 teaspoons sugar, and remaining teaspoon of salt until smooth.  add the remaining coriander, and toss with 1 - 12 teaspoons of the lime juice mixture until smooth ; stir with a spatula until combined.  spoon evenly over the hot flan, leaving just enough space between.  top with the coriander mixture when the flan is completely set and slightly warm, and drizzle with some chopped fresh cilantro. 


",Wasabi & Coconut Flan
249,"parsley leaf,cornstarch",," 1 1/3 cups dried danish herbs, washed, chopped | 4 tablespoons cornstarch | 1 cup fresh parsley leaves "," stir the dried herbs with 1 tbs cornstarch in a small bowl until they are dissolved.  mix in 1 tbs cornstarch with a fork until the mixture is smooth and liquid, using 1tbs as necessary.  stir in 1 tbs parsley, 2 teaspoons dry oregano, or about 1tbs parsley leaves, 1 tsp dried basil, and a teaspoon warm water.  stir with a fork until thoroughly combined.  shape the mixture into a tortilla or bread, cut side down, and grill for about 40 minutes or until desired degree of doneness. 


",Danish Herb Torte
250,"dill,egg noodle,chipotle chile,pomegranate seed,egg,soy sauce",," 1 cup coconut cream | 1/4 cup sugar | 1 egg, beaten | 2/3 cup vegetable oil | 1 small green onion, sliced and separated into rings | 10 ounces egg noodles ( small pasta ) | 8 ounces egg noodles ( small pasta ) | 2 teaspoons fresh dill ( chopped ) | 1 tablespoon fresh lemon peel ( grated ) | 1/2 teaspoon soy sauce "," to make the egg noodles  in a large bowl, beat the coconut cream with the sugar and the egg.  add the egg and stir just until blended.  season with soy sauce, lemon peel and dill.  add the minced green onions, soy sauce and the shredded egg noodles.  season well.  cover and refrigerate overnight.  cook the egg noodles, in the refrigerator, for one hour or until crisp.  to make the egg noodles  combine the cornstarch and sugar in a small bowl ; slowly beat the egg mixture into the cornstarch mixture until it holds together.  refrigerate until cooled. 


",Coconut Cream With Lemon Dressing
251,"egg noodle,vermouth,gruyere cheese,chocolate syrup,cream chicken soup,broth",, 5 ounces sugar | 3 ounces cream of chicken soup | 1 teaspoon vanilla extract | 1/4 teaspoon vanilla ice cream | 1 lb unsweetened chocolate syrup | 1 package cream of chicken soup | 8 ounces dried vermouth | 2 cups shredded gruyere cheese ," put all ingredients in a medium bowl, then divide between greased 9inch pie casseroles.  bake 30  40 minutes  depending on oven you will need to add a little more cheese on top of the last 10 to 12 minutes of baking.  place in refrigerator to cook. 


",Bobby's Favorite Broth Casserole
252,"sushi rice,pecan,grand marnier,olive oil,mint",," 6 cups sifted sushi rice | 1 cup finely chopped spring onion | 1 teaspoon finely chopped coriander | 2 teaspoons sugar | 1 teaspoon finely chopped mint | 1/2 teaspoon pureed curry paste | 1 package frozen chopped pecans | 1 cup light browned muslin or 1/2 cup other seafood rice, thawed and drained | 1 tablespoon fresh lemon juice "," in a small bowl, stir together the sushi rice, spring onions, coriander, sugar, and mint.  stir in curry paste and mix until the sugar dissolves.  mix in peas and muslin.  heat remaining oil in a wok or skillet over mediumhigh heat.  when hot, stir in lemon juice.  cook rice until rice begins to brown, stirring occasionally.  transfer to a platter.  serve warm or cold. 


",Yamato Rice
253,"granny smith apple,korean chili flake,jalapeno pepper,mango,bicarbonate soda,puff pastry,coconut milk,curry powder",," 1 package puff pastry, thawed if frozen and thawed | 2 packages mangoes ( about 1/3 cup.
    - or frozen ) | 1/4 cup korean chili flakes, chopped fine | 1 large granny smith apple, chopped fine | 1/4 cup coconut milk | 1 1/2 teaspoons bicarbonate of soda | 1/2 teaspoon curry powder | 4 teaspoons baking powder | 2 teaspoons mixtures sour cream ( i use low fat maple syrup ) "," preheat oven to 350f set an oven rack about 5 to 6 inches from the heat source for the pastry.  line 2 baking sheets with parchment paper, and spray with nonstick spray, making sure no sheets come up the sides of the sheet.  line the bottom of the baking sheet with parchment.  in a large bowl, combine mango, korean chilli flakes, apple, coconut milk, bicarbonate of soda, baking powder, sour cream, and sour cream.  toss to combine well.  bake in preheated oven for 1520 minutes, or until crust is light brown and apples are tender.  serve warm with mashed potatoes. 


",Puff Pie With Coconut Milk
254,"clove,pineapple,four cheese mexican,almond extract,ginger root,green chili pepper,pie shell,corn cob",," 1/2 cup finely chopped peeled fresh pineapple | 1/4 cup finely chopped peeled peeled slivered almonds | 1 teaspoon almond extract ( about 2 teaspoons ) | 1/4 teaspoon ground ginger root | 3/4 lb pie shell, baked about 3 hours or until firm, firm but firm to the touch | 4 slices four-cheese mexican blend ( about 4 large ) | 1 1/2 - 2 cups corn kernels or 1 1/2-2 cups any other small corn, kernels removed and rinsed, drained, reserving juice | 1/4 cup toasted grated four-cheese mexican blend "," in a medium saucepan heat 1 teaspoon of the almond extract and 1 teaspoon of the crushed ginger.  saute about 3 minutes.  add the pineapple, slivered almonds, almonds, and almond extract mixture and cook over low heat covered, stirring often, until evenly browned, about 30 minutes.  drain the pineapple liquid.  transfer the pineapple mixture to a large bowl.  in a small bowl combine the corn and the remaining 2 teaspoons of ground ginger.  mix well.  transfer the mixture to a pie pan and bake in a 350 oven for 40 minutes, or until the filling is nicely browned.  remove the pie from the oven and cut each serving in half. 


",Pineapple and Fingers Pie
255,"plum tomato,dark chocolate,parmigiano reggiano cheese,cassava,red currant jelly,trout fillet",," 1 package small tart fillets, cut diagonally into 1/2 inch cubes | 1/2 cup chopped fresh cherries | 1/3 cup cherry, with stems, diced small | 6 ounces plum tomatoes, halved | 1 cup dark chocolate, coarsely chopped | 2 1/2 teaspoons sherry wine | 3/4 teaspoon grated parmigiano-reggiano cheese "," in a medium bowl, combine the chopped cherries, cherry, tomatoes, chocolate, sherry, parmigianoreggiano cheese and the reserved cherries.  mix well.  refrigerate for 30 minutes.  preheat the oven to 375 degrees f 190 degrees c.  in a large baking dish, layer the fillets ; top with the cherry mixture.  bake in the preheated oven until fillets are browned and crispy, about 45 minutes.  remove from the oven and transfer to a serving dish.  serve warm. 


",Chocolate Strudel
256,"coconut milk,beef stew meat,veal,green pepper",," 3 teaspoons curry powder | 1 1/2 lbs beef stew meat | 1 garlic powder | 1/2 teaspoon ground coriander powder | 1/2 teaspoon cumin powder | 6 ounces sour cream | 1/2 cup coconut milk, well blended | 1 1/2 cups green peppers, diced "," cut beef into thin strips and brown in olive oil in skillet until the meat is browned and crispy.  add curry powder, ground coriander powder, cumin and the cream, mix well and simmer on low for 30 minutes or until thickened and sauce is thickened. 


",Vegetarian Beef Curry
257,"tortilla chip,avocado,pear,bread,soy sauce,cream cheese,french bread",," 4 slices bacon, cut in strips | 1 can chopped ripe tomatoes ( optional ) | 1 cup french bread, shredded ( about 1/2 cup ) | 1/2 cup sour cream | 1/2 cup low-fat milk | 1 can sliced ripe avocado | 1/4 cup chopped fresh lettuce | 4 drops soy sauce "," cook bacon at a medium heat until crisp, about 1 - 12 minutes.  to prepare the topping, break up the tomatoes.  slice each tomato slightly.  remove any seeds from the tomatoes.  stir in the bread, sour cream, milk, and sliced avocado.  top with the lettuce, soy sauce and a squeeze of sour cream if desired. 


",Cheesy Pear French Toast
258,"morton lite salt,cooking oil,chipotle pepper,cream asparagus soup,thyme",," cooking oil | 1/2 lb fresh fresh asparagus, trimmed and cut into 1 inch pieces | 4 large cucumbers ( about 1 cup ) or 4 cups frozen frozen peeled tomatoes | 3/4 cup fresh basil, chopped | 2 tablespoons fresh thyme, chopped | 2 tablespoons fresh lemon juice, chopped | 1/4 teaspoon sugar | 2 teaspoons fresh lime juice, grated ( or 1/4 tsp.
    - grated ) | 4 cups plain sour cream | 3 tablespoons reduced-sodium chipotle peppers ( or to taste ) | 1 medium sized garlic clove, minced "," bring 3 qts.  of the salted cooking oil to a boil over high heat.  add the asparagus and cook for 5 minutes, skimming off any brown spots, remove from the pot.  discard stems.  in the same pan heat the cooking oil over moderately high heat.  add the asparagus and cook for 2 minutes, skimming off any brown spots.  in a blender or food processor pure the tomatoes, basil and thyme until smooth.  add the lemon juice, sugar, lime juice, sugar and salt, mixing well.  add the chilled chopped cucumber and cook for 5 minutes, skimming off any scum left on the bottom of the pan, until the asparagus wilts.  add the sour cream, chipotles, and garlic and mix well.  transfer to the plate and garnish with the chopped parsley if using.  refrigerate until cooled before serving. 


",Chilli Salsa
259,"thyme sprig,eggplant",, 6 tablespoons eggplants or 6 tablespoons eggplants | 1 sprig fresh thyme | 4 slices whole thyme sprigs ," slice eggplant lengthwise and in a single layer on a very clean surface using the knife.  peel the eggplant.  place them on plate with the eggplant skinside up, on another dish or plate, and keep them in the refrigerator.  grill the eggplant skinside down until very light brown, 4 to 5 hours.  cut the slices into 1 or 2 thin slices to serve. 


",A Very Delicious Eggplant (Visser Kircher)
260,"double cream,rice",, 1 pint double cream | 3 tablespoons sugar | 1 bottle red wine vinegar | 1 teaspoon sugar ," combine sugar and vinegar in a pan and stir gently until sugar dissolves.  gradually pour the cream into the pan in a steady stream and whisk gently until it begins to stick to the sides of the pan.  continue whisking until the mixture boils but slightly bubbles.  serve with lemon rind, cherry and powdered sugar. 


",French Dressing-Cherry Sour Cream
261,"masa harina flour,vegetable stock,roast pork,self rising flour,basil leaf,veal,beer",," 1 tablespoon vegetable stock | 1/2 lb roast pork, cut into 2-3 pieces | 3 cups self-rising flour | salt and pepper | 5 cups beer | 2 tablespoons masa harina flour | 2 tablespoons chili oil | 36 -48 boneless skinless veal cutlets | 1 small basil leaf, shredded "," preheat the oven to 350f.  sift the flour and salt together ; rub into the roast pork.  combine the beer, masa harina flour, chili oil and the remaining ingredients in the bottom of a slow cooker.  pour the mixture into the meat pan, and bring to the boil, then season with salt and pepper, allowing the mixture to be absorbed by the pork.  reduce the heat to low, cover and cook on high about 15 minutes or until the meat pulls apart easily.  remove the meat and keep warm.  to make the gravy place the sliced veal cutlets in the slow cooker ; sprinkle with chopped basil.  cook on high for 10 minutes or until they have turned pink when pierced with a fork.  the gravy can be made 3 days ahead, and refrigerated.  serve the meat gravy with the chicken. 


",Slow Cooker Beef and Pork Lamb Stewed in Beer
262,"garlic,baby spinach,melon,water chestnut,strawberry",," 5 fresh water chestnuts, chopped | 1 can baby spinach, drained, washed and patted dry | 4 cups fresh strawberries, chilled and cut in half | 1 tablespoon water chestnut puree | 3 cloves garlic, minced "," put all the ingredients into a blender with a touch of salt and pepper.  in a serving bowl, combine the chilled spinach with the frozen strawberries and water chestnuts to form a rough consistancy.  serve immediately. 


",Garlic and Strawberry Salad I
263,"taco seasoning,masa harina,avocado",," 9 ounces ground beef | 3 ripe avocados, mashed ( you 'll need 1 avocado if you're going to use this ) | 2 cups salsa, of your choice ( mexican style style ) | 1 packet taco seasoning mix, or more ( mexican spicy seasoning is our favourite ) "," toast tortillas in a microwave on high for 10 minutes or until crisp on the bottom.  remove from microwave and let cool enough to handle, about 10 minutes while you are assembling the chips.  in a skillet, heat the ground beef and avocado lightly.  when the burger is slightly browned, remove and set aside.  mix salsa, taco seasoning mix, and taco meat evenly in the bottom of a 13 x 9 inches baking dish, and spread the beans evenly over the meat.  sprinkle the avocado layer evenly over the beans and the beans are evenly distributed, and spread the remaining taco meat mixture evenly around the beans, leaving a thin layer of taco meat. 


",The Best Taco Meatball and Chips!
264,"yeast,beef stew meat,mix,farfalle pasta,chicken bouillon cube,olive,basil,italian seasoning",," 1 1/2 pounds beef stew meat or 1 1/2 pounds lamb, cut into 1-inch cubes | 1 tablespoon dried basil ( optional, italian thyme, oregano, parsley, mint ) | 2 teaspoons dried onion ( optional, italian basil, parsley, mint ) | 2 teaspoons dried minced garlic ( optional, italian thyme, oregano, parsley ) | 1 teaspoon dried italian seasoning | 1/2 teaspoon beef bouillon cube | 1/2 teaspoon dried basil "," place all ingredients in a large bowl over low heat and stir together well.  add enough water to cover and bring to a boil.  cover and simmer until meat is tender and flavors are infused, about 30 minutes.  remove meat from pot and reserve.  serve over warm pasta with a salad of mixed veggies, fresh vegetables and more olive. 


",Mixed Italian Beef Stew
265,"eggplant,sea salt,prune,bulb fennel,naan bread,harissa,farfalle pasta",," 2/3 cup all-purpose flour | 1/2 teaspoon sea salt | 1 ounce dried chickpeas, rinsed and dried | 2 teaspoons dried harissa | 1/2 teaspoon ground cinnamon | 1 tablespoon red pepper flakes | 1 ounce fresh lemon juice | 1/8 teaspoon garlic clove, minced | 1/2 teaspoon black pepper | 1/2 cup dried coarsely chopped peanuts | 2 cups farfalle pasta, cooked al dente | 1 medium eggplant, large cut into serving pieces | 1/4 cup of thinly sliced apricot "," in a large bowl, combine the flour, salt,  chickpeas, harissa, dijon, cinnamon and pepper flakes.  in a medium bowl, combine the lemon juice and garlic, and stir to blend.  in a small bowl, stir together the shrimp and the drained chickpeas ; set aside.  preheat an oven to 375f.  lightly oil a 9x13 baking dish.  in a small bowl, toss the feta sauce with the dried chickpeas.  repeat for the other ingredients until the feta sauce is completely combined.  pour the mixture into the prepared baking dish, and bake uncovered for 40 minutes or until top is tender and bubbly.  top with the eggplants, apricots, and the reserved drained chickpeas.  cover with foil and bake an additional 45 for 15 minutes or until the cheese has melted and the sauce has absorbed.  serve warm with a slice of avocado, if desired. 


",Low Fat Falafel With Pesto and Chickpeas
266,"molasses,sherry,sunflower seed,vegetable oil",, 8 tablespoons sunflower seeds | 2 tablespoons molasses | 2 teaspoons baking powder | 3/4 cup vegetable oil ," grind all ingredients except oil in a food processor with spices, adding water if you need to.  roll mixture into 4 balls.  heat oil in a wok until hot.  stir fry balls in oil and fry until golden brown. 


",Paprika
267,"yogurt,parmigiano reggiano cheese,szechuan bean sauce,jumbo pasta shell,ice water",, 1 package thawed jumbo pasta shells | 1 cup ice water | 2/3 cup fresh grated parmigiano-reggiano cheese | 1/4 cup light yogurt ," cook noodles according to package instructions.  drain and set aside.  stir the jumbo into a bowl with 3 to 4 tablespoons of the ice water.  stir in the grated cheese.  stir in the yogurt.  divide mixture into 6 serving bowls, top with noodles and serve. 


","Cheese-Spiced Tomato Bolognese, Peppers and Szechuan Bean Sauce"
268,"tarragon leaf,vegetable broth,artichoke heart,peanut butter",, 1 tablespoon vegetable oil | 1 package firm acorn artichoke hearts | 1 teaspoon dried tarragon leaves | 1/4 cup peanut butter | 1/4 cup coconut milk | 1 package frozen peeled and quartered tofu slices ," heat the oil in a large saucepan over medium heat.  stir in the artichoke hearts ; cook and stir until tender, about 5 minutes.  pour into a bowl, and reserve.  in a small bowl, whisk the peanut butter, coconut milk, and tofu together.  pour the mixture into a blender puree the tofu sauce by pulsing a few times until smooth.  place tofu in a blender puree until smooth.  remove the tofu from the sauce in the blender with a slotted spoon, and scrape up any drippings.  stir the sauce into the tofu. 


",Artichokes With Sassy Tropical Sauce
269,"butternut squash,banana,yogurt,cardamom powder,water chestnut,iceberg lettuce,milk ricotta cheese,spice",," 1 butternut squash, peeled, cut into about 1/8x1/4-inch pieces | 2 cups milk or 2 cups water | 6 slices ripe tomatoes | 1/2 cup sugar | 1 teaspoon baking powder | 1/2 teaspoon cinnamon | 1/2 teaspoon cardamom powder | 3/4 cup yogurt | 3/4 cup yogurt | 1 cup iceberg lettuce, shredded | 1/3 cup banana, diced | 1/3 cup water chestnut, diced "," combine squash, milk and water in a large saucepan.  bring to a boil over high heat, reduce heat, cover, reduce heat to low and simmer over medium heat, covered, stirring occasionally 1 hour.  remove from heat ; slice into 1 to 1 - 12 inch squares.  place cubed squash into a 9x13 inch casserole dish.  mix sugar, yogurt and yogurt mixture together in a bowl.  stir in frozen corn with marinara or frozen corn in the dish.  mix yogurt mixture with crushed iceberg lettuce and banana.  cover and refrigerate.  preheat oven to 350 degrees f 175 degrees c.  in a nonstick skillet with a removable bottom, heat the margarita mix over medium high heat until bubbling, about 2 minutes.  remove from heat.  meanwhile, chop and mix strawberries and banana together in a small bowl ; add to skillet with crushed corn ; stir to combine. 


",Creamy Butternut Squash
270,"five spice powder,spice rub,garam masala,spring green,yellow onion,port wine,green chili pepper",," 2 -3 tablespoons five-spice rub | 1 yellow onion, diced | 2 green chili peppers, seeded and diced ( optional ) | 1 -2 green chile pepper, seeded and diced ( optional ) | 5 ml port wine or 5 ml other heavy red wine | 2 teaspoons ground cloves-garam masala "," mix all ingredients well for a creamy rub.  store in an airtight jar in air tight containers for up to one week. 


",Spiced Five Spice Sweet Wine Rub Mix
271,"peppermint extract,bibb lettuce,lemon juice concentrate",," 1 lbs pork tenderloin, trimmed and cut into 1-inch cubes | 1 garlic clove, minced | 3 carrots, chopped | 1 celery, chopped | 2 tablespoons honey | 1/2 fresh lemon juice concentrate or 1/4 cup bottled lemon juice | 1/2 cup pillsbury cucumber, chopped | 1/8 teaspoon peppermint extract | 1/2 teaspoon lemon zest | 1/2 teaspoon mustard | 1/4 teaspoon ground pepper "," place all the ingredients into a large bowl.  pour the ingredients over the pork and season with salt and pepper.  cover and marinate the pork covered, in the refrigerator for 1 - 12 to 3 hours or overnight.  remove the pork from the marinade and refrigerate until the pork is well chilled, at least 5 hours.  remove the pork from the refrigerator and allow to stand in the refrigerator for another 24 hours or overnight.  if the pork is extremely tender, refrigerate for 3 hours in an airtight container until chilled.  if not, refrigerate at least another 3 hours before serving.  serve immediately.  the pork can be preroasted or baked before preparing the filling to use if you have not refrigerated. 


",Sweet and Sour BBQ Pork Filling With Cherry Tomatoes
